{"contract":"helianthus.platform.draft-candidate-fact-replay.v1","graph_hash":"sha256:9291ab6dc01c97153d6bd1c05ae7326954d6f536eb44ba109cf3e85d183a04a4","graph_id":"dcfgv1:sha256:9291ab6dc01c97153d6bd1c05ae7326954d6f536eb44ba109cf3e85d183a04a4","registry_digest":"sha256:e6895b8d7406b58ed97599d8da7e9bd3b252e6e7ca3b0578ec6385bfe6dfe1c0","replay_hash":"sha256:e08d8ad1b2cf45a13c3e8fc27258778d5c5055818e8dfa8592a0440731ab0f07","replay_id":"dcfrv1:sha256:e08d8ad1b2cf45a13c3e8fc27258778d5c5055818e8dfa8592a0440731ab0f07","results":[{"candidate_id":"m7-candidate-1001","comparator_outcome":"NOT_EVALUATED","confidence":{"basis":"INSUFFICIENT","level":"LOW","score_milli":0},"fact_hash":"sha256:9ee2173a37741b5a5f93f8537e0d590c321a7c4d40029cbe8a985ca57b2cb72a","native_evidence_digests":["sha256:2222222222222222222222222222222222222222222222222222222222222222"],"proposed_path":"/source_terminal/b509","source_terminal":{"binding_source_kind":"EBUS_B509","error_category":"BACKEND_UNAVAILABLE","evidence_digests":["sha256:2222222222222222222222222222222222222222222222222222222222222222"],"identity_family":"B509","phase":"pre","source_contract":"helianthus.ebus.b509.evidence.v1","source_id":"ebus-11111111111111111111111111111111","source_kind":"EBUS","source_schema_version":1,"state":"UNAVAILABLE"},"status":"WITHHELD","terminal_negative_state":"NOT_TESTED"},{"candidate_id":"m7-candidate-1002","comparator_outcome":"NOT_EVALUATED","confidence":{"basis":"INSUFFICIENT","level":"LOW","score_milli":0},"fact_hash":"sha256:f31ac6218f4e6bc5a76aae9563f150c44c9c0de6d8a551f3e8e17eacdde8854b","native_evidence_digests":["sha256:3333333333333333333333333333333333333333333333333333333333333333"],"proposed_path":"/source_terminal/b524","source_terminal":{"binding_source_kind":"EBUS_B524","error_category":"BACKEND_UNAVAILABLE","evidence_digests":["sha256:3333333333333333333333333333333333333333333333333333333333333333"],"identity_family":"B524","phase":"action","source_contract":"helianthus.ebus.b524.evidence.v1","source_id":"ebus-22222222222222222222222222222222","source_kind":"EBUS","source_schema_version":1,"state":"UNAVAILABLE"},"status":"WITHHELD","terminal_negative_state":"NOT_TESTED"},{"candidate_id":"m7-candidate-1003","comparator_outcome":"NOT_EVALUATED","confidence":{"basis":"INSUFFICIENT","level":"LOW","score_milli":0},"fact_hash":"sha256:5082984555e24e4db8c5d00fc8a39f710b3b3aa3d9c90067a1bd3a0d400dde0b","native_evidence_digests":["sha256:4444444444444444444444444444444444444444444444444444444444444444"],"proposed_path":"/source_terminal/b555","source_terminal":{"binding_source_kind":"EBUS_B555","error_category":"BACKEND_UNAVAILABLE","evidence_digests":["sha256:4444444444444444444444444444444444444444444444444444444444444444"],"identity_family":"B555","phase":"post","source_contract":"helianthus.ebus.b555.evidence.v1","source_id":"ebus-33333333333333333333333333333333","source_kind":"EBUS","source_schema_version":1,"state":"UNAVAILABLE"},"status":"WITHHELD","terminal_negative_state":"NOT_TESTED"}],"schema_version":1,"source_bundle":{"bundle_hash":"sha256:cf839e04ae891e24bf65cb7110e8e0a0aea237051b27a42ba204e801c11988b5","bundle_id":"sebv1:sha256:cf839e04ae891e24bf65cb7110e8e0a0aea237051b27a42ba204e801c11988b5","replay_hash":"sha256:a006b928a28339a7080d81565eede4eff9fcba1943cd28537f1f59f3dc1f1bb5"}}
